name,mana_cost,cmc,type_line,oracle_text,image_url
Absolute Virtue,{6}{W}{U},8.0,Legendary Creature — Avatar Warrior,"This spell can't be countered. Flying You have protection from each of your opponents. (You can't be dealt damage, enchanted, or targeted by anything controlled by your opponents.)",https://cards.scryfall.io/normal/front/a/a/aa192912-c9ee-403f-8a46-a338c9edb4b9.jpg?1748706551
Adelbert Steiner,{1}{W},2.0,Legendary Creature — Human Knight,Lifelink Adelbert Steiner gets +1/+1 for each Equipment you control.,https://cards.scryfall.io/normal/front/1/a/1a67a991-1e52-4676-a2e3-2bc7aa943ab3.jpg?1748705765
Adventurer's Airship,{3},3.0,Artifact — Vehicle,"Flying Whenever this Vehicle attacks, draw a card, then discard a card. Crew 2 (Tap any number of creatures you control with total power 2 or more: This Vehicle becomes an artifact creature until end of turn.)",https://cards.scryfall.io/normal/front/0/a/0a1d6dcd-bd41-4f57-a35b-6613811fe4d4.jpg?1748718939
Adventurer's Inn,,0.0,Land — Town,"When this land enters, you gain 2 life. {T}: Add {C}.",https://cards.scryfall.io/normal/front/f/0/f0da2ee1-986e-4cbf-92eb-d96fdb572ca5.jpg?1748706796
Aerith Gainsborough,{2}{W},3.0,Legendary Creature — Human Cleric,"Lifelink Whenever you gain life, put a +1/+1 counter on Aerith Gainsborough. When Aerith Gainsborough dies, put X +1/+1 counters on each legendary creature you control, where X is the number of +1/+1 counters on Aerith Gainsborough.",https://cards.scryfall.io/normal/front/e/8/e86328b6-ded2-41df-8b6e-4a770e7b171e.jpg?1748705770
Aerith Rescue Mission,{3}{W},4.0,Sorcery,"Choose one — • Take the Elevator — Create three 1/1 colorless Hero creature tokens. • Take 59 Flights of Stairs — Tap up to three target creatures. Put a stun counter on one of them. (If a permanent with a stun counter would become untapped, remove one from it instead.)",https://cards.scryfall.io/normal/front/3/1/3123d16c-e1e6-4659-a7a3-2ec6efc6bf08.jpg?1748705771
Aettir and Priwen,{6},6.0,Legendary Artifact — Equipment,"Equipped creature has base power and toughness X/X, where X is your life total. Equip {5}",https://cards.scryfall.io/normal/front/0/3/038710ca-c756-4e66-a9de-278e676c9f5b.jpg?1748706739
Ahriman,{2}{B},3.0,Creature — Eye Horror,"Flying, deathtouch {3}, Sacrifice another creature or artifact: Draw a card.",https://cards.scryfall.io/normal/front/1/6/162a415c-5465-497e-8f4e-c6f09681641d.jpg?1748706087
Airship Crash,{2}{G},3.0,Instant,"Destroy target artifact, enchantment, or creature with flying. Cycling {2} ({2}, Discard this card: Draw a card.)",https://cards.scryfall.io/normal/front/e/c/ec91c4e4-711f-464d-bc83-e6813f4fdcdb.jpg?1750188044
Al Bhed Salvagers,{2}{B},3.0,Creature — Human Artificer Warrior,"Whenever this creature or another creature or artifact you control dies, target opponent loses 1 life and you gain 1 life.",https://cards.scryfall.io/normal/front/5/8/58ccdcfc-a669-480f-bded-4273cfaf2045.jpg?1748706093
Ambrosia Whiteheart,{1}{W},2.0,Legendary Creature — Bird,"Flash When Ambrosia Whiteheart enters, you may return another permanent you control to its owner's hand. Landfall — Whenever a land you control enters, Ambrosia Whiteheart gets +1/+0 until end of turn.",https://cards.scryfall.io/normal/front/f/2/f2596767-7d19-4110-86ed-3cfc93ac7483.jpg?1748705777
Ancient Adamantoise,{5}{G}{G}{G},8.0,Creature — Turtle,"Vigilance, ward {3} Damage isn't removed from this creature during cleanup steps. All damage that would be dealt to you and other permanents you control is dealt to this creature instead. When this creature dies, exile it and create ten tapped Treasure tokens.",https://cards.scryfall.io/normal/front/4/c/4c139f30-5ecd-48fd-ae7c-ec2cc98889ff.jpg?1748706406
"Ardyn, the Usurper",{5}{B}{B}{B},8.0,Legendary Creature — Elder Human Noble,"Demons you control have menace, lifelink, and haste. Starscourge — At the beginning of combat on your turn, exile up to one target creature card from a graveyard. If you exiled a card this way, create a token that's a copy of that card, except it's a 5/5 black Demon.",https://cards.scryfall.io/normal/front/4/6/4627072e-9c72-4084-8021-690777342548.jpg?1748706094
A Realm Reborn,{4}{G}{G},6.0,Enchantment,"Other permanents you control have ""{T}: Add one mana of any color.""",https://cards.scryfall.io/normal/front/d/1/d1af74e4-38d5-44b5-85e1-4d13f6970453.jpg?1748706495
"Ashe, Princess of Dalmasca",{2}{W},3.0,Legendary Creature — Human Rebel Noble,"Whenever Ashe attacks, look at the top five cards of your library. You may reveal an artifact card from among them and put it into your hand. Put the rest on the bottom of your library in a random order.",https://cards.scryfall.io/normal/front/f/f/ffe0596f-ef99-4862-9386-0fe455259995.jpg?1748705778
Astrologian's Planisphere,{1}{U},2.0,Artifact — Equipment,"Job select (When this Equipment enters, create a 1/1 colorless Hero creature token, then attach this to it.) Equipped creature is a Wizard in addition to its other types and has ""Whenever you cast a noncreature spell and whenever you draw your third card each turn, put a +1/+1 counter on this creature."" Diana — Equip {2}",https://cards.scryfall.io/normal/front/b/f/bfa4e927-1d6f-4a64-9801-7d168a5ef3f6.jpg?1748705924
Auron's Inspiration,{2}{W},3.0,Instant,Attacking creatures get +2/+0 until end of turn. Flashback {2}{W}{W} (You may cast this card from your graveyard for its flashback cost. Then exile it.),https://cards.scryfall.io/normal/front/7/7/77d82764-563c-4bc2-b568-625ec7215e0d.jpg?1748705784
"Balamb Garden, SeeD Academy // Balamb Garden, Airborne",,0.0,Land — Town // Legendary Artifact — Vehicle,,
Balamb T-Rexaur,{4}{G}{G},6.0,Creature — Dinosaur,"Trample When this creature enters, you gain 3 life. Forestcycling {2} ({2}, Discard this card: Search your library for a Forest card, reveal it, put it into your hand, then shuffle.)",https://cards.scryfall.io/normal/front/e/5/e5857b1b-73bc-458e-b26b-7ed8bef785f3.jpg?1748706407
Balthier and Fran,{1}{R}{G},3.0,Legendary Creature — Human Rabbit,"Reach Vehicles you control get +1/+1 and have vigilance and reach. Whenever a Vehicle crewed by Balthier and Fran this turn attacks, if it's the first combat phase of the turn, you may pay {1}{R}{G}. If you do, after this phase, there is an additional combat phase.",https://cards.scryfall.io/normal/front/a/f/afcaed7d-7ea3-4f2a-a7f5-ee3315226369.jpg?1748706557
Bard's Bow,{2}{G},3.0,Artifact — Equipment,"Job select (When this Equipment enters, create a 1/1 colorless Hero creature token, then attach this to it.) Equipped creature gets +2/+2, has reach, and is a Bard in addition to its other types. Perseus's Bow — Equip {6} ({6}: Attach to target creature you control. Equip only as a sorcery.)",https://cards.scryfall.io/normal/front/2/a/2ac03e90-1e16-453f-88e4-a0448db73403.jpg?1748706414
"Baron, Airship Kingdom",,0.0,Land — Town,This land enters tapped. {T}: Add {U} or {R}.,https://cards.scryfall.io/normal/front/6/e/6e4bf840-802d-47d5-bffd-8ba495e19cf6.jpg?1748706809
Barret Wallace,{3}{R},4.0,Legendary Creature — Human Rebel,"Reach Whenever Barret Wallace attacks, it deals damage equal to the number of equipped creatures you control to defending player.",https://cards.scryfall.io/normal/front/1/a/1a504dff-5857-4a61-ab99-616d5df7cf5a.jpg?1748706246
Bartz and Boko,{3}{G}{G},5.0,Legendary Creature — Human Bird,"Affinity for Birds (This spell costs {1} less to cast for each Bird you control.) When Bartz and Boko enters, each other Bird you control deals damage equal to its power to target creature an opponent controls.",https://cards.scryfall.io/normal/front/d/8/d818d574-2832-4a7a-a13b-aa6e695fdaa5.jpg?1748706414
Battle Menu,{1}{W},2.0,Instant,Choose one — • Attack — Create a 2/2 white Knight creature token. • Ability — Target creature gets +0/+4 until end of turn. • Magic — Destroy target creature with power 4 or greater. • Item — You gain 4 life.,https://cards.scryfall.io/normal/front/2/4/240e1466-bd02-423d-b829-234dcd2bfab2.jpg?1748705785
"Beatrix, Loyal General",{4}{W}{W},6.0,Legendary Creature — Human Soldier,"Vigilance (Attacking doesn't cause this creature to tap.) At the beginning of combat on your turn, you may attach any number of Equipment you control to target creature you control.",https://cards.scryfall.io/normal/front/9/d/9da83b07-4978-4af7-be51-8aa8f35ec0bb.jpg?1748707600
Black Mage's Rod,{1}{B},2.0,Artifact — Equipment,"Job select (When this Equipment enters, create a 1/1 colorless Hero creature token, then attach this to it.) Equipped creature gets +1/+0, has ""Whenever you cast a noncreature spell, this creature deals 1 damage to each opponent,"" and is a Wizard in addition to its other types. Equip {3}",https://cards.scryfall.io/normal/front/3/5/35e8f140-055f-4fc7-a765-fb030d828214.jpg?1748706099
Black Waltz No. 3,{2}{B}{R},4.0,Legendary Creature — Wizard,"Flying, deathtouch Whenever you cast a noncreature spell, Black Waltz No. 3 deals 2 damage to each opponent.",https://cards.scryfall.io/normal/front/f/e/fe86e41b-b0f6-4aa1-8827-c095c721f304.jpg?1748706560
Blazing Bomb,{R},1.0,Creature — Elemental,"Whenever you cast a noncreature spell, if at least four mana was spent to cast it, put a +1/+1 counter on this creature. Blow Up — {T}, Sacrifice this creature: It deals damage equal to its power to target creature. Activate only as a sorcery.",https://cards.scryfall.io/normal/front/7/0/70f47277-ca47-428a-808f-0fb32e820a71.jpg?1748706252
Blitzball,{3},3.0,Artifact,"{T}: Add one mana of any color. GOOOOAAAALLL! — {T}, Sacrifice this artifact: Draw two cards. Activate only if an opponent was dealt combat damage by a legendary creature this turn.",https://cards.scryfall.io/normal/front/9/2/92f4ad73-42bf-45c0-8bb6-0b44043c81ef.jpg?1748706744
Blitzball Shot,{1}{G},2.0,Instant,Target creature gets +3/+3 and gains trample until end of turn.,https://cards.scryfall.io/normal/front/e/c/ec8ab637-3d7d-4712-9f83-8920f808f715.jpg?1748706420
Buster Sword,{3},3.0,Artifact — Equipment,"Equipped creature gets +3/+2. Whenever equipped creature deals combat damage to a player, draw a card, then you may cast a spell from your hand with mana value less than or equal to that damage without paying its mana cost. Equip {2}",https://cards.scryfall.io/normal/front/3/7/374d7383-a1a7-4eea-91f7-290180e14cc9.jpg?1748706745
Cactuar,{G},1.0,Creature — Plant,"Trample At the beginning of your end step, if this creature didn't enter the battlefield this turn, return it to its owner's hand.",https://cards.scryfall.io/normal/front/d/5/d5273db4-6214-41e4-825a-612fca8bbe03.jpg?1748706421
Call the Mountain Chocobo,{3}{R},4.0,Sorcery,"Search your library for a Mountain card, reveal it, put it into your hand, then shuffle. Create a 2/2 green Bird creature token with ""Whenever a land you control enters, this token gets +1/+0 until end of turn."" Flashback {5}{R} (You may cast this card from your graveyard for its flashback cost. Then exile it.)",https://cards.scryfall.io/normal/front/b/2/b2e1986c-2852-4843-bdc4-eddb727ba3d4.jpg?1748706252
Capital City,,0.0,Land — Town,"{T}: Add {C}. {1}, {T}: Add one mana of any color. Cycling {2} ({2}, Discard this card: Draw a card.)",https://cards.scryfall.io/normal/front/f/7/f73ce8ec-c916-48eb-ae20-c0d6d03d7145.jpg?1748706809
Cargo Ship,{1}{U},2.0,Artifact — Vehicle,"Flying, vigilance {T}: Add {C}. Spend this mana only to cast an artifact spell or activate an ability of an artifact source. Crew 1 (Tap any number of creatures you control with total power 1 or more: This Vehicle becomes an artifact creature until end of turn.)",https://cards.scryfall.io/normal/front/9/3/932b865c-bfe7-4bb7-82e9-2403cf0e0522.jpg?1748705931
"Cecil, Dark Knight // Cecil, Redeemed Paladin",,1.0,Legendary Creature — Human Knight // Legendary Creature — Human Knight,,
Chocobo Kick,{1}{G},2.0,Sorcery,"Kicker—Return a land you control to its owner's hand. (You may return a land you control to its owner's hand in addition to any other costs as you cast this spell.) Target creature you control deals damage equal to its power to target creature an opponent controls. If this spell was kicked, the creature you control deals twice that much damage instead.",https://cards.scryfall.io/normal/front/f/f/ff8c8be0-8223-499c-8704-cb68e0a42ce2.jpg?1748706427
Chocobo Racetrack,{3}{G}{G},5.0,Artifact,"Landfall — Whenever a land you control enters, create a 2/2 green Bird creature token with ""Whenever a land you control enters, this token gets +1/+0 until end of turn.""",https://cards.scryfall.io/normal/front/1/5/1565813b-6912-42f4-bae0-22136a2d6a92.jpg?1748706428
Choco-Comet,{X}{R}{R},2.0,Sorcery,"Choco-Comet deals X damage to any target. Create a 2/2 green Bird creature token with ""Whenever a land you control enters, this token gets +1/+0 until end of turn.""",https://cards.scryfall.io/normal/front/8/d/8d8d3903-a7f4-4cd8-8d29-b4a173e4fbb2.jpg?1748706258
"Choco, Seeker of Paradise",{1}{G}{W}{U},4.0,Legendary Creature — Bird,"Whenever one or more Birds you control attack, look at that many cards from the top of your library. You may put one of them into your hand. Then put any number of land cards from among them onto the battlefield tapped and the rest into your graveyard. Landfall — Whenever a land you control enters, Choco gets +1/+0 until end of turn.",https://cards.scryfall.io/normal/front/4/0/409c305a-52dc-4538-8e72-efcd568eaf49.jpg?1748706564
"Cid, Timeless Artificer",{2}{W}{U},4.0,Legendary Creature — Human Artificer,"Artifact creatures and Heroes you control get +1/+1 for each Artificer you control and each Artificer card in your graveyard. A deck can have any number of cards named Cid, Timeless Artificer. Cycling {W}{U} ({W}{U}, Discard this card: Draw a card.)",https://cards.scryfall.io/normal/front/7/f/7fb99393-d2b6-40a6-8de7-317efdc4c50b.jpg?1748706567
Circle of Power,{3}{B},4.0,Sorcery,"You draw two cards and you lose 2 life. Create a 0/1 black Wizard creature token with ""Whenever you cast a noncreature spell, this token deals 1 damage to each opponent."" Wizards you control get +1/+0 and gain lifelink until end of turn.",https://cards.scryfall.io/normal/front/c/9/c969bd0f-f174-4e2f-b95c-c9ccd5d0b8ba.jpg?1748706110
Clash of the Eikons,{G},1.0,Sorcery,Choose one or more — • Target creature you control fights target creature an opponent controls. • Remove a lore counter from target Saga you control. (Removing lore counters doesn't cause chapter abilities to trigger.) • Put a lore counter on target Saga you control.,https://cards.scryfall.io/normal/front/7/5/75c18134-f517-4a68-8640-0426b3cd4f6c.jpg?1748706434
"Clive, Ifrit's Dominant // Ifrit, Warden of Inferno",,6.0,Legendary Creature — Human Noble Warrior // Legendary Enchantment Creature — Saga Demon,,
Clive's Hideaway,,0.0,Land — Town,"Hideaway 4 (When this land enters, look at the top four cards of your library, exile one face down, then put the rest on the bottom in a random order.) {T}: Add {C}. {2}, {T}: You may play the exiled card without paying its mana cost if you control four or more legendary creatures.",https://cards.scryfall.io/normal/front/5/e/5e43c36f-b8a2-4b2b-b2ea-57e6fa97521c.jpg?1748706815
Cloudbound Moogle,{3}{W}{W},5.0,Creature — Moogle,"Flying When this creature enters, put a +1/+1 counter on target creature. Plainscycling {2} ({2}, Discard this card: Search your library for a Plains card, reveal it, put it into your hand, then shuffle.)",https://cards.scryfall.io/normal/front/7/3/7387bca7-f496-45da-a0ac-6be049303a8f.jpg?1748705792
"Cloud, Midgar Mercenary",{W}{W},2.0,Legendary Creature — Human Soldier Mercenary,"When Cloud enters, search your library for an Equipment card, reveal it, put it into your hand, then shuffle. As long as Cloud is equipped, if an ability of Cloud or an Equipment attached to it triggers, that ability triggers an additional time.",https://cards.scryfall.io/normal/front/2/c/2cf7e8a3-fad7-413d-b17c-7519a9cf5fb5.jpg?1748705791
Cloud of Darkness,{2}{B}{G}{G},5.0,Legendary Creature — Avatar,"Flying Particle Beam — When Cloud of Darkness enters, target creature an opponent controls gets -X/-X until end of turn, where X is the number of permanent cards in your graveyard.",https://cards.scryfall.io/normal/front/a/2/a292094a-674a-401f-8776-ba5ebe57c946.jpg?1748706571
"Cloud, Planet's Champion",{3}{R}{W},5.0,Legendary Creature — Human Soldier Mercenary,"During your turn, as long as Cloud is equipped, it has double strike and indestructible. (This creature deals both first-strike and regular combat damage. Damage and effects that say ""destroy"" don't destroy this creature.) Equip abilities you activate that target Cloud cost {2} less to activate.",https://cards.scryfall.io/normal/front/a/6/a6d58067-337d-43dc-b4a3-c6acc701d450.jpg?1749021792
Coeurl,{1}{W},2.0,Creature — Cat Beast,"{1}{W}, {T}: Tap target nonenchantment creature.",https://cards.scryfall.io/normal/front/7/6/7604b534-5480-42fa-bc36-bbae730f8582.jpg?1748705798
Coliseum Behemoth,{5}{G}{G},7.0,Creature — Beast,"Trample When this creature enters, choose one — • Destroy target artifact or enchantment. • Draw a card.",https://cards.scryfall.io/normal/front/9/0/900206f1-7dd6-4db9-a430-73e560fd196b.jpg?1748706435
Combat Tutorial,{2}{U},3.0,Sorcery,Target player draws two cards. Put a +1/+1 counter on up to one target creature you control.,https://cards.scryfall.io/normal/front/e/c/ec195607-ac30-4931-acfd-f9d8ac8b047f.jpg?1748705932
Commune with Beavers,{G},1.0,Sorcery,"Look at the top three cards of your library. You may reveal an artifact, creature, or land card from among them and put it into your hand. Put the rest on the bottom of your library in any order.",https://cards.scryfall.io/normal/front/7/8/784287c2-43c5-4210-93ae-cdd33b9acb1b.jpg?1748706441
Coral Sword,{R},1.0,Artifact — Equipment,"Flash When this Equipment enters, attach it to target creature you control. That creature gains first strike until end of turn. Equipped creature gets +1/+0. Equip {1}",https://cards.scryfall.io/normal/front/1/3/13e81e32-7246-46b9-872e-cde77cedd197.jpg?1748706265
Cornered by Black Mages,{1}{B}{B},3.0,Sorcery,"Target opponent sacrifices a creature of their choice. Create a 0/1 black Wizard creature token with ""Whenever you cast a noncreature spell, this token deals 1 damage to each opponent.""",https://cards.scryfall.io/normal/front/6/8/688fcf8a-0a44-416a-8086-83acf9a6fe69.jpg?1748706113
Crossroads Village,,0.0,Land — Town,"This land enters tapped. As it enters, choose a color. {T}: Add one mana of the chosen color.",https://cards.scryfall.io/normal/front/6/4/64db46d4-f91f-49cc-971c-b8e19f0c4ea9.jpg?1748706815
Crystal Fragments // Summon: Alexander,{W},1.0,Artifact — Equipment // Enchantment Creature — Saga Construct,,
Dark Confidant,{1}{B},2.0,Creature — Human Wizard,"At the beginning of your upkeep, reveal the top card of your library and put that card into your hand. You lose life equal to its mana value.",https://cards.scryfall.io/normal/front/2/5/2520ab23-a068-4462-b261-2754409b4108.jpg?1748706117
Dark Knight's Greatsword,{2}{B},3.0,Artifact — Equipment,"Job select (When this Equipment enters, create a 1/1 colorless Hero creature token, then attach this to it.) Equipped creature gets +3/+0 and is a Knight in addition to its other types. Chaosbringer — Equip—Pay 3 life. Activate only once each turn.",https://cards.scryfall.io/normal/front/b/5/b50dcc7c-260f-4d8c-9a9e-9244ec23a91e.jpg?1748706120
Deadly Embrace,{3}{B}{B},5.0,Sorcery,Destroy target creature an opponent controls. Then draw a card for each creature that died this turn.,https://cards.scryfall.io/normal/front/a/1/a11cb85c-85dd-435c-8303-4d0d18bdb1e9.jpg?1748707601
Delivery Moogle,{3}{W},4.0,Creature — Moogle,"Flying When this creature enters, search your library and/or graveyard for an artifact card with mana value 2 or less, reveal it, and put it into your hand. If you search your library this way, shuffle.",https://cards.scryfall.io/normal/front/f/5/f58840dc-c641-4092-8b67-9c0d449af715.jpg?1748705812
Demon Wall,{1}{B},2.0,Artifact Creature — Demon Wall,"Defender Menace (This creature can't be blocked except by two or more creatures.) As long as this creature has a counter on it, it can attack as though it didn't have defender. {5}{B}: Put two +1/+1 counters on this creature.",https://cards.scryfall.io/normal/front/1/3/13abd96c-d1af-43d0-b3a4-ac3db20e3b51.jpg?1748706126
Diamond Weapon,{7}{G}{G},9.0,Legendary Artifact Creature — Elemental,This spell costs {1} less to cast for each permanent card in your graveyard. Reach Immune — Prevent all combat damage that would be dealt to Diamond Weapon.,https://cards.scryfall.io/normal/front/6/c/6ce7f494-2a19-4b11-94d4-fc5e5a7068bd.jpg?1748706442
"Dion, Bahamut's Dominant // Bahamut, Warden of Light",,4.0,Legendary Creature — Human Noble Knight // Legendary Enchantment Creature — Saga Dragon,,
Dragoon's Lance,{1}{W},2.0,Artifact — Equipment,"Job select (When this Equipment enters, create a 1/1 colorless Hero creature token, then attach this to it.) Equipped creature gets +1/+0 and is a Knight in addition to its other types. During your turn, equipped creature has flying. Gae Bolg — Equip {4}",https://cards.scryfall.io/normal/front/9/6/96630531-8eb7-4e3e-8d63-60c562a5571b.jpg?1748705819
Dragoon's Wyvern,{2}{U},3.0,Creature — Drake,"Flying When this creature enters, create a 1/1 colorless Hero creature token.",https://cards.scryfall.io/normal/front/d/9/d92bce20-308e-4841-aaf8-8e20698292e7.jpg?1748705937
Dreams of Laguna,{1}{U},2.0,Instant,"Surveil 1, then draw a card. (To surveil 1, look at the top card of your library. You may put it into your graveyard.) Flashback {3}{U} (You may cast this card from your graveyard for its flashback cost. Then exile it.)",https://cards.scryfall.io/normal/front/b/a/ba752243-2727-4b8a-8e21-e70becfd4ff3.jpg?1748705940
Dwarven Castle Guard,{1}{W},2.0,Creature — Dwarf Soldier,"When this creature dies, create a 1/1 colorless Hero creature token.",https://cards.scryfall.io/normal/front/e/1/e17c0d27-e88d-4ba9-acbb-3f916cee3d7e.jpg?1748705825
"Eden, Seat of the Sanctum",,0.0,Land — Town,"{T}: Add {C}. {5}, {T}: Mill two cards. Then you may sacrifice this land. When you do, return another target permanent card from your graveyard to your hand.",https://cards.scryfall.io/normal/front/e/2/e28eac1e-adc7-4f8d-b206-bef09ba07d38.jpg?1748706821
"Edgar, King of Figaro",{4}{U}{U},6.0,Legendary Creature — Human Artificer Noble,"When Edgar enters, draw a card for each artifact you control. Two-Headed Coin — The first time you flip one or more coins each turn, those coins come up heads and you win those flips.",https://cards.scryfall.io/normal/front/9/5/950ee302-5512-43c5-ac7c-b2b06f4177bf.jpg?1748705945
Eject,{3}{U},4.0,Instant,This spell can't be countered. Return target nonland permanent to its owner's hand. Draw a card.,https://cards.scryfall.io/normal/front/a/e/aec83c9a-8ec4-4a5a-b27f-0e74a2b3d21e.jpg?1748705947
Elixir,{1},1.0,Artifact,"This artifact enters tapped. {5}, {T}, Exile this artifact: Shuffle all nonland cards from your graveyard into your library. You gain life equal to the number of cards shuffled into your library this way.",https://cards.scryfall.io/normal/front/a/4/a4b05d37-df62-475c-8371-735ed2fa1b05.jpg?1748706750
"Emet-Selch, Unsundered // Hades, Sorcerer of Eld",,3.0,Legendary Creature — Elder Wizard // Legendary Creature — Avatar,,
Esper Origins // Summon: Esper Maduin,,2.0,Sorcery // Enchantment Creature — Saga Elemental,,
Ether,{3}{U},4.0,Artifact,"{T}, Exile this artifact: Add {U}. When you next cast an instant or sorcery spell this turn, copy that spell. You may choose new targets for the copy.",https://cards.scryfall.io/normal/front/8/9/896ee6e9-15a9-4974-b576-50f4759fac38.jpg?1748705952
Evil Reawakened,{4}{B},5.0,Sorcery,Return target creature card from your graveyard to the battlefield with two additional +1/+1 counters on it.,https://cards.scryfall.io/normal/front/e/b/eb98cbc3-749c-44f4-974c-00be1286d69e.jpg?1748706130
Excalibur II,{1},1.0,Legendary Artifact — Equipment,"Whenever you gain life, put a charge counter on Excalibur II. Equipped creature gets +1/+1 for each charge counter on Excalibur II. Equip {3}",https://cards.scryfall.io/normal/front/d/4/d42e5fed-67ac-46d7-a5d4-78f661f3e8b4.jpg?1748706751
"Exdeath, Void Warlock // Neo Exdeath, Dimension's End",,3.0,Legendary Creature — Spirit Warlock // Legendary Creature — Spirit Avatar,,
"Fang, Fearless l'Cie",{2}{B},3.0,Legendary Creature — Human Warrior,"Whenever one or more cards leave your graveyard, you draw a card and you lose 1 life. This ability triggers only once each turn. (Melds with Vanille, Cheerful l'Cie.)",https://cards.scryfall.io/normal/front/f/7/f73a5cbb-905f-4b99-8d23-9d1b6bd47ee8.jpg?1746914128
Fate of the Sun-Cryst,{4}{W},5.0,Instant,This spell costs {2} less to cast if it targets a tapped creature. Destroy target nonland permanent.,https://cards.scryfall.io/normal/front/9/0/900cdf11-b42e-4dcc-97c3-2e4d8e406a70.jpg?1748705825
Fight On!,{2}{B},3.0,Instant,Return up to two target creature cards from your graveyard to your hand.,https://cards.scryfall.io/normal/front/e/1/e1b0739a-dcc4-4034-96d7-69e551b2f36b.jpg?1748706137
Fire Magic,{R},1.0,Instant,Tiered (Choose one additional cost.) • Fire — {0} — Fire Magic deals 1 damage to each creature. • Fira — {2} — Fire Magic deals 2 damage to each creature. • Firaga — {5} — Fire Magic deals 3 damage to each creature.,https://cards.scryfall.io/normal/front/4/1/415ff6a5-61ef-4b37-ae08-e44476300d4a.jpg?1748706272
